{
  "operator": "gemm",
  "packs": [
    {
      "approval_id": "approval-proposal-asmevo-gemm-20260917t050538z-gfx1151-k0-817bd5fbe4e49024-approved",
      "artifacts": [
        {
          "artifact": "lib/radeon_kernels_wmma_gfx1151.so",
          "entrypoint": "gemm_out",
          "evidence_id": "asmevo-gemm-20260917t050538z-gfx1151-k0",
          "format": "python_extension",
          "operator": "gemm",
          "provider": "native",
          "semantic_version": "1.0",
          "sha256": "c8fb5969147b2e47dd8857e547a5fbd2a9d166bb58b1ad0871aa78ffcc8c28b6"
        }
      ],
      "environment": {
        "architecture": "gfx1151",
        "python_abi": "cp312",
        "pytorch_version": "2.14.0a0+rocm7.15.0a20260719",
        "rocm_abi": "7.15",
        "wavefront_size": 32
      },
      "manifest_sha256": "1a965166d1ad4ce7a34f238671f09b1620edd84751269c910bf0e3af988a660b",
      "manifest_signature": {
        "algorithm": "ed25519",
        "key_id": "rk-release-2026-09",
        "schema_version": "1.0",
        "signature": "6C2L3zZAWUY+O7bsQZVoWOBMynA4jPFkvcsO1bZOsoOyFGSl1bI0gul1J6dfSUsmEDWdFRWPuvxkjFnlHdBvBQ==",
        "signed_file": "manifest.json",
        "signed_sha256": "1a965166d1ad4ce7a34f238671f09b1620edd84751269c910bf0e3af988a660b"
      },
      "pack_id": "rk-gemm-gfx1151-rocm715-cp312-torch2140a0",
      "pack_version": "0.1.0",
      "release_file": "rk-gemm-gfx1151-rocm715-cp312-torch2140a0-0.1.0.tar.gz",
      "release_sha256": "f01bf64b5b258589e953044974e09f1e6f2f4355f821fe25433d4e8688e9002b",
      "release_size": 193468
    }
  ],
  "schema_version": "1.0",
  "semantic_version": "1.0"
}
